"title","price","sold_out","link"
"Vitrolith. Pink glass and Rhodonite. 5”x2.5”x2.5”",850,"sold out","/available-work/tfsy2ma2316pjwql8e67anfv80ii50"
"PREVIEW: Vitrolith. Jasper and crimson glas. 7”x3”x3”.",850,"sold out","/available-work/tc092y8bqt7xixcyotblymvdbv6qjj"
"PREVIEW: Vitrolith. Jasper and tan glass. 5”x2”x2”",650,"sold out","/available-work/t5oy69pi6z2znpsgzmvuzlhhbqeg4j"
"PREVIEW: Moonrise (classic). 4.5”x3.5”x1”.",600,"sold out","/available-work/gsn5nag1p4mfavt4totazhen4fcx2j"
"PREVIEW: Vitrolith. Basalt and glass. 3”x2”x2”",550,"sold out","/available-work/ksc0gf934h91exa47cy5df41v6lwyc"
"PREVIEW: Pocket Sculpture—glass and jasper. 3”x1”x1”",375,"sold out","/available-work/nuozccwieetcia2ypzlaosashu31sf"
"PREVIEW: Golden Moonrise Orb. 3”x3”x3”",800,NA,"/available-work/8rnuhgyxn1xnyyy5lj4zc0gpz18a3h"
