"title","price","sold_out","link"
"Big’ Mystery Pocket Sculpture!!",350,TRUE,"/available-work/u2htbnxjbyoi780zh8m1o3q9g3ifi6"
"Golden Moonrise Disc. Gold glass and stone. 4” x 4” x 2”",1100,TRUE,"/available-work/4n3ngtmvwovwrwdkubmi71yy5tpjv8"
"Boulder Opal Vitrolith. Cast glass and boulder opal. 2” x 2” x 1.5”",750,TRUE,"/available-work/xl1uhxwckmj0yad6w81t9zol7mi7m3"
"Spectrolite Vitrolith. 3” x 3” x 1”.",750,TRUE,"/available-work/fpv4aqr303ciwx9qvzhadv1jv3guzc"
"Crimson Amber Vitrolith. 8.5” x 4” x 4”",1800,FALSE,"/available-work/z6za5qh29d4zhkk35nj94o5s96ad8z"
"Aerolith. Opaline glass and stone. 3” x 2.5” x 2.5”",550,TRUE,"/available-work/j8w063er1oe3vwo2drex0zkwl3y1yl"
